{
  "generator": {
    "name": "LayaPhi",
    "version": "0.1.0"
  },
  "seed": "phi-reader",
  "inputHash": "31567f07a9b4953b",
  "archetype": "explainer",
  "signature": {
    "id": "editorial-mono",
    "name": "Editorial Mono",
    "modeTreatment": "outline",
    "rejected": []
  },
  "navigation": "minimal",
  "sourcePresentation": "footnotes",
  "leadOrientation": "typographic",
  "tokenOverrides": {
    "columnRatio": "2:1",
    "whitespace": 0.85
  },
  "components": [
    {
      "id": "lead",
      "component": "article-lead",
      "props": {
        "density": "comfortable",
        "alignment": "start",
        "columns": 1,
        "mediaPosition": "top",
        "textWidth": "comfortable",
        "sectionSpacing": "normal",
        "emphasis": "high",
        "cardTreatment": "plain",
        "borderTreatment": "none",
        "backgroundTreatment": "none",
        "collapse": "none"
      }
    },
    {
      "id": "toc",
      "component": "toc",
      "props": {
        "density": "comfortable",
        "alignment": "start",
        "columns": 1,
        "mediaPosition": "top",
        "textWidth": "comfortable",
        "sectionSpacing": "normal",
        "emphasis": "low",
        "cardTreatment": "none",
        "borderTreatment": "none",
        "backgroundTreatment": "none",
        "collapse": "none"
      }
    },
    {
      "id": "s-forces",
      "component": "lesson",
      "section": "forces",
      "mode": "blue",
      "props": {
        "density": "comfortable",
        "alignment": "start",
        "columns": 1,
        "mediaPosition": "end",
        "textWidth": "comfortable",
        "sectionSpacing": "normal",
        "emphasis": "low",
        "cardTreatment": "plain",
        "borderTreatment": "none",
        "backgroundTreatment": "none",
        "collapse": "none"
      }
    },
    {
      "id": "s-numbers",
      "component": "statistics",
      "section": "numbers",
      "mode": "blue",
      "props": {
        "density": "comfortable",
        "alignment": "start",
        "columns": 1,
        "mediaPosition": "top",
        "textWidth": "comfortable",
        "sectionSpacing": "normal",
        "emphasis": "low",
        "cardTreatment": "plain",
        "borderTreatment": "none",
        "backgroundTreatment": "none",
        "collapse": "none"
      }
    },
    {
      "id": "s-designs",
      "component": "feature-grid",
      "section": "designs",
      "mode": "green",
      "props": {
        "density": "comfortable",
        "alignment": "start",
        "columns": 1,
        "mediaPosition": "top",
        "textWidth": "comfortable",
        "sectionSpacing": "normal",
        "emphasis": "low",
        "cardTreatment": "plain",
        "borderTreatment": "none",
        "backgroundTreatment": "none",
        "collapse": "none"
      }
    },
    {
      "id": "s-gallery",
      "component": "gallery",
      "section": "gallery",
      "mode": "yellow",
      "props": {
        "density": "comfortable",
        "alignment": "start",
        "columns": 1,
        "mediaPosition": "top",
        "textWidth": "comfortable",
        "sectionSpacing": "normal",
        "emphasis": "low",
        "cardTreatment": "plain",
        "borderTreatment": "none",
        "backgroundTreatment": "none",
        "collapse": "none"
      }
    },
    {
      "id": "s-timeline",
      "component": "timeline",
      "section": "timeline",
      "mode": "blue",
      "props": {
        "density": "comfortable",
        "alignment": "start",
        "columns": 1,
        "mediaPosition": "top",
        "textWidth": "comfortable",
        "sectionSpacing": "normal",
        "emphasis": "low",
        "cardTreatment": "plain",
        "borderTreatment": "none",
        "backgroundTreatment": "none",
        "collapse": "none"
      }
    },
    {
      "id": "s-myths",
      "component": "comparison",
      "section": "myths",
      "mode": "red",
      "props": {
        "density": "comfortable",
        "alignment": "start",
        "columns": 1,
        "mediaPosition": "top",
        "textWidth": "comfortable",
        "sectionSpacing": "normal",
        "emphasis": "low",
        "cardTreatment": "plain",
        "borderTreatment": "none",
        "backgroundTreatment": "none",
        "collapse": "none"
      }
    },
    {
      "id": "s-faq",
      "component": "faq",
      "section": "faq",
      "mode": "red",
      "props": {
        "density": "comfortable",
        "alignment": "start",
        "columns": 1,
        "mediaPosition": "top",
        "textWidth": "comfortable",
        "sectionSpacing": "normal",
        "emphasis": "low",
        "cardTreatment": "plain",
        "borderTreatment": "none",
        "backgroundTreatment": "none",
        "collapse": "none"
      }
    },
    {
      "id": "s-build-a-truss",
      "component": "project",
      "section": "build-a-truss",
      "mode": "orange",
      "props": {
        "density": "comfortable",
        "alignment": "start",
        "columns": 1,
        "mediaPosition": "end",
        "textWidth": "comfortable",
        "sectionSpacing": "normal",
        "emphasis": "low",
        "cardTreatment": "plain",
        "borderTreatment": "none",
        "backgroundTreatment": "none",
        "collapse": "none"
      }
    },
    {
      "id": "s-quote",
      "component": "quote",
      "section": "quote",
      "mode": "yellow",
      "props": {
        "density": "comfortable",
        "alignment": "start",
        "columns": 1,
        "mediaPosition": "top",
        "textWidth": "comfortable",
        "sectionSpacing": "normal",
        "emphasis": "low",
        "cardTreatment": "plain",
        "borderTreatment": "none",
        "backgroundTreatment": "none",
        "collapse": "none"
      }
    },
    {
      "id": "s-related",
      "component": "related",
      "section": "related",
      "mode": "yellow",
      "props": {
        "density": "comfortable",
        "alignment": "start",
        "columns": 1,
        "mediaPosition": "top",
        "textWidth": "comfortable",
        "sectionSpacing": "normal",
        "emphasis": "low",
        "cardTreatment": "plain",
        "borderTreatment": "none",
        "backgroundTreatment": "none",
        "collapse": "none"
      }
    },
    {
      "id": "sources",
      "component": "sources",
      "props": {
        "density": "comfortable",
        "alignment": "start",
        "columns": 1,
        "mediaPosition": "top",
        "textWidth": "comfortable",
        "sectionSpacing": "normal",
        "emphasis": "low",
        "cardTreatment": "none",
        "borderTreatment": "none",
        "backgroundTreatment": "none",
        "collapse": "none"
      }
    },
    {
      "id": "footer",
      "component": "footer",
      "props": {
        "density": "comfortable",
        "alignment": "start",
        "columns": 1,
        "mediaPosition": "top",
        "textWidth": "comfortable",
        "sectionSpacing": "normal",
        "emphasis": "low",
        "cardTreatment": "none",
        "borderTreatment": "none",
        "backgroundTreatment": "none",
        "collapse": "none"
      }
    }
  ],
  "mutations": {
    "applied": [
      {
        "id": "column.ratio",
        "target": "split layouts",
        "from": "1:1",
        "to": "2:1",
        "reason": "chosen from 3 compatible options"
      },
      {
        "id": "navigation.style",
        "target": "page",
        "from": "top-bar",
        "to": "minimal",
        "reason": "chosen from 3 compatible options"
      },
      {
        "id": "whitespace",
        "target": "spacing scale",
        "from": 1,
        "to": 0.85,
        "reason": "chosen from 4 compatible options"
      }
    ],
    "rejected": [
      {
        "id": "hero.orientation",
        "value": "full",
        "reason": "reader profile keeps imagery restrained"
      },
      {
        "id": "section.order",
        "value": "stats-early",
        "reason": "no eligible section to move"
      },
      {
        "id": "section.order",
        "value": "media-forward",
        "reason": "reader profile keeps explanatory text ahead of media"
      },
      {
        "id": "column.ratio",
        "value": "1:2",
        "reason": "would squeeze text column below 40% on reader layouts"
      },
      {
        "id": "media.placement",
        "value": "start",
        "reason": "reader profile reads text first; media follows"
      },
      {
        "id": "media.placement",
        "value": "top",
        "reason": "reader profile reads text first; media follows"
      },
      {
        "id": "media.placement",
        "value": "alternate",
        "reason": "alternating placement reserved for balanced layouts"
      },
      {
        "id": "density",
        "value": "compact",
        "reason": "compact density harms readability/tap spacing for this profile"
      },
      {
        "id": "navigation.style",
        "value": "bottom-bar",
        "reason": "not allowed by editorial-mono / reader profile"
      },
      {
        "id": "section.rhythm",
        "value": "accelerating",
        "reason": "uneven rhythm hurts scanning in reader layouts"
      },
      {
        "id": "type.scale",
        "value": 1.125,
        "reason": "differs too far from the signature type scale"
      },
      {
        "id": "type.scale",
        "value": 1.2,
        "reason": "differs too far from the signature type scale"
      },
      {
        "id": "type.scale",
        "value": 1.333,
        "reason": "reader layouts cap heading contrast at 1.25"
      },
      {
        "id": "card.geometry",
        "value": 0,
        "reason": "square signatures stay square"
      },
      {
        "id": "card.geometry",
        "value": 0.5,
        "reason": "square signatures stay square"
      },
      {
        "id": "card.geometry",
        "value": 2,
        "reason": "square signatures stay square"